feature_config,purpose,feature_groups_enabled,new_feature_columns,existing_feature_columns,no_lookahead_tests,session_tests,notes
opening_core_v2,ORB/opening v2 context,vwap; orb; volatility; price_action; volume,orb 5/10/20 columns vs v1; rel_volume_20; volume_mean_20,vwap; vwap_slope_5; vwap_side; vwap_dist_pct; orb_15; atr_like_20; rolling/high low,existing kernels plus feature inspect; ORB kernel already session-local,existing kernels plus Phase18B helper tests,No feature kernel changed.
vwap_level_core_v2,VWAP pullback/reclaim context,vwap; volatility; price_action; volume; regime,rel_volume_20; rolling_high_20; regime columns,vwap; vwap_dist_pct; atr_like_20; close_position_in_range,existing kernels,existing kernels,No feature kernel changed.
gap_level_core_v2,Gap/prior-level reclaim context,levels; vwap; volatility; price_action; volume,rel_volume_20; vwap_dist_pct,prior_session OHLC; open_gap_pct; atr_like_20; rolling columns,existing kernels,existing kernels,No feature kernel changed.
indicator_core_v2,Oscillator context,indicators; vwap; volatility; price_action; volume; regime,vwap_dist_pct; rel_volume_20; regime columns,cci_20; stoch_k_14; stoch_d_14_3; atr_like_20,existing kernels,existing kernels,No feature kernel changed.
pa_core_v2,PA overextension/risk context,vwap; orb; volatility; price_action; volume; regime,vwap_slope_5 retained; range_mean_20; rel_volume_20,PA v1 columns,existing kernels,existing kernels,No feature kernel changed.
